<?xml version="1.0" encoding="UTF-8"?>
<!DOCTYPE review-group SYSTEM "reviews.dtd">
<review-group>
  <version revision="0">
    <review>
      <history>
        <date date-type="assigned">
          <day>17</day>
          <month>05</month>
          <year>2019</year>
        </date>
        <date date-type="due">
          <day>01</day>
          <month>06</month>
          <year>2019</year>
        </date>
        <date date-type="completed">
          <day>31</day>
          <month>05</month>
          <year>2019</year>
        </date>
      </history>
      <contrib-group>
        <contrib contrib-type="reviewer">
          <name>
            <surname>redacted</surname>
            <given-names>redacted</given-names>
            <prefix>redacted</prefix>
          </name>
          <email>redacted</email>
          <xref ref-type="aff" rid="aff1" />
        </contrib>
        <aff id="aff1">redacted</aff>
      </contrib-group>
      <review-item-group>
        <review-item is-confidential="no" review-item-type="comments" sequence-number="6">
          <review-item-question>
            <title>&lt;b&gt;Significance:&lt;/b&gt;</title>
            <alt-title>Significance (Required)</alt-title>
            <text />
          </review-item-question>
          <review-item-response>
            <text>Consectetur adipiscing elit.</text>
          </review-item-response>
        </review-item>
        <review-item is-confidential="no" review-item-type="single-choice" sequence-number="2">
          <review-item-question>
            <title>&lt;b&gt;How much time do you estimate the authors will need to complete the suggested revisions:&lt;/b&gt;</title>
            <alt-title>Estimated time to Complete Revisions (Required)</alt-title>
            <text>(Decision Recommendation)</text>
          </review-item-question>
          <review-item-response>
            <text>Cannot tell / Not applicable</text>
          </review-item-response>
        </review-item>
      </review-item-group>
    </review>
    <review>
      <history>
        <date date-type="assigned">
          <day>22</day>
          <month>05</month>
          <year>2019</year>
        </date>
        <date date-type="due">
          <day>01</day>
          <month>06</month>
          <year>2019</year>
        </date>
        <date date-type="completed">
          <day>29</day>
          <month>05</month>
          <year>2019</year>
        </date>
      </history>
      <contrib-group>
        <contrib contrib-type="reviewer">
          <name>
            <surname>redacted</surname>
            <given-names>redacted</given-names>
            <prefix>redacted</prefix>
          </name>
          <email>redacted</email>
          <xref ref-type="aff" rid="aff2" />
        </contrib>
        <aff id="aff2">redacted</aff>
      </contrib-group>
      <review-item-group>
        <review-item is-confidential="no" review-item-type="comments" sequence-number="6">
          <review-item-question>
            <title>&lt;b&gt;Significance:&lt;/b&gt;</title>
            <alt-title>Significance (Required)</alt-title>
            <text />
          </review-item-question>
          <review-item-response>
            <text>Sed do eiusmod tempor incididunt ut labore et dolore.</text>
          </review-item-response>
        </review-item>
        <review-item is-confidential="no" review-item-type="single-choice" sequence-number="2">
          <review-item-question>
            <title>&lt;b&gt;How much time do you estimate the authors will need to complete the suggested revisions:&lt;/b&gt;</title>
            <alt-title>Estimated time to Complete Revisions (Required)</alt-title>
            <text>(Decision Recommendation)</text>
          </review-item-question>
          <review-item-response>
            <text>Cannot tell / Not applicable</text>
          </review-item-response>
        </review-item>
      </review-item-group>
    </review>
    <review>
      <history>
        <date date-type="assigned">
          <day>28</day>
          <month>05</month>
          <year>2019</year>
        </date>
        <date date-type="due">
          <day>07</day>
          <month>06</month>
          <year>2019</year>
        </date>
        <date date-type="completed">
          <day>06</day>
          <month>06</month>
          <year>2019</year>
        </date>
      </history>
      <contrib-group>
        <contrib contrib-type="reviewer">
          <name>
            <surname>redacted</surname>
            <given-names />
          </name>
          <email />
        </contrib>
      </contrib-group>
      <review-item-group>
        <review-item is-confidential="no" review-item-type="comments" sequence-number="6">
          <review-item-question>
            <title>&lt;b&gt;Significance:&lt;/b&gt;</title>
            <alt-title>Significance (Required)</alt-title>
            <text />
          </review-item-question>
          <review-item-response>
            <text>Cras adipiscing enim eu turpis egestas pretium aenean.</text>
          </review-item-response>
        </review-item>
        <review-item is-confidential="no" review-item-type="single-choice" sequence-number="2">
          <review-item-question>
            <title>&lt;b&gt;How much time do you estimate the authors will need to complete the suggested revisions:&lt;/b&gt;</title>
            <alt-title>Estimated time to Complete Revisions (Required)</alt-title>
            <text>(Decision Recommendation)</text>
          </review-item-question>
          <review-item-response>
            <text>Cannot tell / Not applicable</text>
          </review-item-response>
        </review-item>
      </review-item-group>
    </review>
  </version>
  <version revision="1">
    <review>
      <history>
        <date date-type="assigned">
          <day>12</day>
          <month>08</month>
          <year>2019</year>
        </date>
        <date date-type="due">
          <day>22</day>
          <month>08</month>
          <year>2019</year>
        </date>
        <date date-type="completed">
          <day>21</day>
          <month>12</month>
          <year>2020</year>
        </date>
      </history>
      <contrib-group>
        <contrib contrib-type="reviewer">
          <name>
            <surname>redacted</surname>
            <given-names>redacted</given-names>
            <prefix>redacted</prefix>
          </name>
          <email>redacted</email>
          <xref ref-type="aff" rid="aff1" />
        </contrib>
        <aff id="aff1">redacted</aff>
      </contrib-group>
      <review-item-group>
        <review-item is-confidential="no" review-item-type="comments" sequence-number="5">
          <review-item-question>
            <title>&lt;b&gt;Evidence, reproducibility and clarity:&lt;/b&gt;</title>
            <alt-title>Evidence, reproducibility and clarity (Required)</alt-title>
            <text />
          </review-item-question>
          <review-item-response>
            <text>This is sample of evidence answer</text>
          </review-item-response>
        </review-item>
        <review-item is-confidential="no" review-item-type="comments" sequence-number="6">
          <review-item-question>
            <title>&lt;b&gt;Significance:&lt;/b&gt;</title>
            <alt-title>Significance (Required)</alt-title>
            <text />
          </review-item-question>
          <review-item-response>
            <text>This is a sample of significance</text>
          </review-item-response>
        </review-item>
        <review-item is-confidential="no" review-item-type="single-choice" sequence-number="2">
          <review-item-question>
            <title>&lt;b&gt;How much time do you estimate the authors will need to complete the suggested revisions:&lt;/b&gt;</title>
            <alt-title>Estimated time to Complete Revisions (Required)</alt-title>
            <text>(Decision Recommendation)</text>
          </review-item-question>
          <review-item-response>
            <text>Cannot tell / Not applicable</text>
          </review-item-response>
        </review-item>
      </review-item-group>
    </review>
  </version>
</review-group>
